{
  "schema_version": "2.1",
  "run_id": "ofamas-three-gate",
  "recorded_by": "example-fixture",
  "gates": {
    "gate1": {
      "display_language": "zh-CN",
      "source_artifact": "02_leverage_points.json",
      "task": "选系统切口",
      "selection_guidance": "选择后，系统只会围绕这些切口生成横向方案。这里不是选最终 idea。",
      "recommended_ids": [
        "LP-001",
        "LP-002",
        "LP-004"
      ],
      "selected_ids": [
        "LP-001",
        "LP-002",
        "LP-004"
      ],
      "recorded_at": null,
      "cards": [
        {
          "id": "LP-001",
          "title": "RL02 / BD03 / G01：'一个通用模型服务所有任务'的一对多范式",
          "meta": "paradigm / high",
          "recommended": true,
          "summary_rows": [
            {
              "label": "旧假设",
              "text": "单个通用模型在所有任务域上都应优于或不弱于一对一专门模型。"
            },
            {
              "label": "卡在哪里",
              "text": "RL02 / BD03 / G01：'一个通用模型服务所有任务'的一对多范式"
            },
            {
              "label": "选它后会生成",
              "text": "这是论文最核心的框定。反转它（按域自适应地在通用/专门间路由，或'通用先验+域内特化'混合）能直接重构问题，而不是在原范式内做增量。"
            }
          ],
          "detail_rows": [
            {
              "label": "证据",
              "text": "\"一个通用模型服务所有任务\"一定比\"每域一个专门模型\"好（一对多 vs 一对一本身就是个可反转的框定）"
            },
            {
              "label": "风险",
              "text": "若实证上一对多确实普遍占优，反转会显得无的放矢；需先界定优劣边界（见 LP-003）。"
            }
          ]
        },
        {
          "id": "LP-002",
          "title": "RL05 / BD01 / FM03：'MAS 表现高度依赖拓扑设计'，拓扑被当作...",
          "meta": "paradigm / high",
          "recommended": true,
          "summary_rows": [
            {
              "label": "旧假设",
              "text": "连接拓扑是 MAS 性能的主要决定因素，内容是次要的。"
            },
            {
              "label": "卡在哪里",
              "text": "RL05 / BD01 / FM03：'MAS 表现高度依赖拓扑设计'，拓扑被当作主要矛盾"
            },
            {
              "label": "选它后会生成",
              "text": "若性能更多来自角色/提示/信道内容而非连接结构，则整个优化对象都该换；这能开出'内容-结构联合设计'或'内容优先'的新方向。"
            }
          ],
          "detail_rows": [
            {
              "label": "证据",
              "text": "\"MAS 表现高度依赖拓扑设计\"——拓扑是主要矛盾，那角色定义、提示、信道内容是不是被低估了？"
            },
            {
              "label": "风险",
              "text": "拆解结构与内容的贡献需要受控消融实验，归因困难。"
            }
          ]
        },
        {
          "id": "LP-003",
          "title": "RL03 / BD04 / FM05：评价口径 = 准确率 + token 成本",
          "meta": "rule / high",
          "recommended": false,
          "summary_rows": [
            {
              "label": "旧假设",
              "text": "准确率与 token 成本足以判定一个拓扑的好坏。"
            },
            {
              "label": "卡在哪里",
              "text": "RL03 / BD04 / FM05：评价口径 = 准确率 + token 成本"
            },
            {
              "label": "选它后会生成",
              "text": "评价规则定义了'什么算更好的拓扑'。把鲁棒性、分布漂移稳定性、可解释性、协作过程质量纳入评价，会重塑模型该生成什么样的结构。"
            }
          ],
          "detail_rows": [
            {
              "label": "证据",
              "text": "评价 = benchmark 准确率 + token 成本"
            },
            {
              "label": "风险",
              "text": "新增评价维度可能缺乏现成 benchmark，需要自建测度。"
            }
          ]
        },
        {
          "id": "LP-004",
          "title": "RL04 / B03 / FM01：LLM 合成的'查询-拓扑'对被当作 grou...",
          "meta": "information_flow / high",
          "recommended": true,
          "summary_rows": [
            {
              "label": "旧假设",
              "text": "LLM 合成的拓扑足够接近最优，可直接作为监督信号。"
            },
            {
              "label": "卡在哪里",
              "text": "RL04 / B03 / FM01：LLM 合成的'查询-拓扑'对被当作 ground truth"
            },
            {
              "label": "选它后会生成",
              "text": "把'合成数据质量'本身当作研究对象（噪声标签、置信度加权、合成器与学习器的同质化偏差）可能比改模型结构更能提升泛化。"
            }
          ],
          "detail_rows": [
            {
              "label": "证据",
              "text": "训练数据靠 LLM 合成的\"查询–拓扑\"对，默认这些合成拓扑是高质量的 ground truth"
            },
            {
              "label": "风险",
              "text": "缺少真实最优拓扑作金标准，质量差距难以直接测量。"
            }
          ]
        },
        {
          "id": "LP-005",
          "title": "RL01 / BD02 / T01：拓扑是静态 DAG，先生成后执行",
          "meta": "structure / high",
          "recommended": false,
          "summary_rows": [
            {
              "label": "旧假设",
              "text": "协作结构应在执行前一次性确定且保持静态。"
            },
            {
              "label": "卡在哪里",
              "text": "RL01 / BD02 / T01：拓扑是静态 DAG，先生成后执行"
            },
            {
              "label": "选它后会生成",
              "text": "打开'先生成后执行'这个边界，转向运行时自组织/动态演化/带反馈纠偏的拓扑，是结构层面的大重构。"
            }
          ],
          "detail_rows": [
            {
              "label": "证据",
              "text": "拓扑是静态 DAG，先生成后执行"
            },
            {
              "label": "风险",
              "text": "动态拓扑会大幅增加系统复杂度与评测难度。"
            }
          ]
        },
        {
          "id": "LP-006",
          "title": "A01→A02 / F02 / BD02：拓扑由学出来的模型一次性生成预测",
          "meta": "self_organization / medium",
          "recommended": false,
          "summary_rows": [
            {
              "label": "旧假设",
              "text": "拓扑必须由一个中央训练好的生成模型来产出。"
            },
            {
              "label": "卡在哪里",
              "text": "A01→A02 / F02 / BD02：拓扑由学出来的模型一次性生成预测"
            },
            {
              "label": "选它后会生成",
              "text": "把'生成主体'从中央模型转移到 agent 自组织（agent 之间协商/招募/演化出拓扑），是对'谁来设计结构'的反转，可能带来无需大规模训练的方案。"
            }
          ],
          "detail_rows": [
            {
              "label": "证据",
              "text": "协作拓扑应该由一个学出来的模型一次性生成/预测，而不是在运行时自组织或演化"
            },
            {
              "label": "风险",
              "text": "自组织可能不稳定、难以保证全局质量与可控性。"
            }
          ]
        },
        {
          "id": "LP-007",
          "title": "T03 / S03 / F06：经验验证图获取滞后，监督信号稀缺",
          "meta": "delay / medium",
          "recommended": false,
          "summary_rows": [
            {
              "label": "旧假设",
              "text": "高质量监督只能来自事后经验验证过的图，且更新缓慢。"
            },
            {
              "label": "卡在哪里",
              "text": "T03 / S03 / F06：经验验证图获取滞后，监督信号稀缺"
            },
            {
              "label": "选它后会生成",
              "text": "缩短'执行→验证→纳入微调'的反馈延迟（在线/主动学习、用执行轨迹即时打分）能让模型更快从真实表现学习，而非依赖滞后的合成先验。"
            }
          ],
          "detail_rows": [
            {
              "label": "证据",
              "text": "③ 在经验验证过的图上做监督微调"
            },
            {
              "label": "风险",
              "text": "在线验证成本高，可能引入不稳定的反馈噪声。"
            }
          ]
        },
        {
          "id": "LP-008",
          "title": "B03 / A03 / A01：合成器与学习器的强化自循环（同质化）",
          "meta": "feedback_loop / medium",
          "recommended": false,
          "summary_rows": [
            {
              "label": "旧假设",
              "text": "用同源 LLM 合成数据不会损害拓扑多样性与泛化。"
            },
            {
              "label": "卡在哪里",
              "text": "B03 / A03 / A01：合成器与学习器的强化自循环（同质化）"
            },
            {
              "label": "选它后会生成",
              "text": "若合成器与被训模型口味相互强化导致拓扑多样性坍缩，引入多样性/对抗性合成或异质评判者可打破该回路，提升泛化。"
            }
          ],
          "detail_rows": [
            {
              "label": "证据",
              "text": "并用 LLM 驱动的数据合成来降低标注成本"
            },
            {
              "label": "风险",
              "text": "多样性与质量之间存在张力，强行增多样可能降低单点质量。"
            }
          ]
        },
        {
          "id": "LP-009",
          "title": "S04 / A01（MoE）/ F05：MoE 专家容量与任务到专家的路由",
          "meta": "structure / medium",
          "recommended": false,
          "summary_rows": [
            {
              "label": "旧假设",
              "text": "MoE 专家应按任务动态选择来预测节点和边。"
            },
            {
              "label": "卡在哪里",
              "text": "S04 / A01（MoE）/ F05：MoE 专家容量与任务到专家的路由"
            },
            {
              "label": "选它后会生成",
              "text": "把专家划分维度从'任务'改为'结构基元/协作模式/失败模式'，或让专家可增删演化，会改变模型复用结构知识的方式。"
            }
          ],
          "detail_rows": [
            {
              "label": "证据",
              "text": "MoE（专家混合）：按任务动态选择子网络来预测节点和边"
            },
            {
              "label": "风险",
              "text": "重新定义专家划分缺乏明确监督，路由可能退化。"
            }
          ]
        }
      ]
    },
    "gate2": {
      "display_language": "zh-CN",
      "source_artifact": "03_lateral_reframes.json",
      "task": "选要审计的横向方案",
      "selection_guidance": "这里选“值得审计”的方案，不是在证明它正确。优先选看点清楚、风险也说得清楚的方案。",
      "recommended_ids": [
        "LR-001",
        "LR-003",
        "LR-004",
        "LR-006"
      ],
      "selected_ids": [
        "LR-001",
        "LR-003",
        "LR-004",
        "LR-006"
      ],
      "recorded_at": null,
      "cards": [
        {
          "id": "LR-001",
          "title": "通用模型打底、域内特化补差:在线估计当前任务落在通用模型能力边界外的程度,据此决定...",
          "meta": "LP-001",
          "recommended": true,
          "summary_rows": [
            {
              "label": "旧→新",
              "text": "单个通用模型服务所有任务,一对多一定优于或不弱于每域专门模型。 -> 通用模型打底、域内特化补差:在线估计当前任务落在通用模型能力边界外的程度,据此决定是否切到专门分支。"
            },
            {
              "label": "人话方案",
              "text": "为通用模型加一个'边界检测器',对高不确定性域路由到轻量专门头,低不确定性域直接用通用预测。"
            },
            {
              "label": "看点",
              "text": "把论文的核心二元对立化解成一个可度量的路由问题,绕开'谁普遍更好'的无解之争。"
            },
            {
              "label": "风险",
              "text": "不要只做个对两者输出取平均的 ensemble,而不解释'何时该专门化'的判据。"
            }
          ],
          "detail_rows": [
            {
              "label": "来源切口",
              "text": "LP-001"
            },
            {
              "label": "内部生成方式",
              "text": "reversal"
            },
            {
              "label": "改变的假设",
              "text": "一对多与一对一是互斥的范式选择。"
            },
            {
              "label": "lateral move",
              "text": "把'通用 vs 专门二选一'反转成'按域不确定性在两者间动态路由'。"
            }
          ]
        },
        {
          "id": "LR-002",